{
  "schema_version": "1.1",
  "event_id": "sha256:2a0f87570c5892227e7e76ca5e667cfe1803979c3a2216ec022a50f95dc25b6d",
  "idempotency_key": "sha256:e8613435f8e5338d20dbc255f02dd7af085a0321d8f114ef3886be7687616df6",
  "accession_number": "0001320461-25-000012",
  "cik": "0001320461",
  "ticker": null,
  "form_type": "8-K",
  "primary_document": null,
  "filed_at": "2025-02-14T12:04:21Z",
  "observed_at": "2025-02-15T06:00:11Z",
  "source": {
    "adapter": "daily-index",
    "source_uri": "https://www.sec.gov/Archives/edgar/data/1320461/0001320461-25-000012.txt"
  }
}
